{
  "caseId": "ret-authorization-06",
  "judgments": [
    {
      "candidateId": "auth-aserto-topaz",
      "grade": 2,
      "provenance": {
        "reviewAuthorityDigest": "c64f49c7a7211b5e0304fd9e568dcd625e669d4f31395d21c815d9fe92f91f20",
        "reviewAuthorityVersion": "retrieval-relevance-independent-review/1.0.0",
        "reviewReference": "issue-23",
        "reviewStatus": "independently-reviewed",
        "status": "accepted"
      },
      "reasonCodes": [
        "negative-control-comparison-alternative"
      ]
    },
    {
      "candidateId": "auth-authzed-spicedb",
      "grade": 2,
      "provenance": {
        "reviewAuthorityDigest": "c64f49c7a7211b5e0304fd9e568dcd625e669d4f31395d21c815d9fe92f91f20",
        "reviewAuthorityVersion": "retrieval-relevance-independent-review/1.0.0",
        "reviewReference": "issue-23",
        "reviewStatus": "independently-reviewed",
        "status": "accepted"
      },
      "reasonCodes": [
        "negative-control-comparison-alternative"
      ]
    },
    {
      "candidateId": "auth-casbin-casbin",
      "grade": 2,
      "provenance": {
        "reviewAuthorityDigest": "c64f49c7a7211b5e0304fd9e568dcd625e669d4f31395d21c815d9fe92f91f20",
        "reviewAuthorityVersion": "retrieval-relevance-independent-review/1.0.0",
        "reviewReference": "issue-23",
        "reviewStatus": "independently-reviewed",
        "status": "accepted"
      },
      "reasonCodes": [
        "negative-control-comparison-alternative"
      ]
    },
    {
      "candidateId": "auth-casbin-casbin-js",
      "grade": 2,
      "provenance": {
        "reviewAuthorityDigest": "c64f49c7a7211b5e0304fd9e568dcd625e669d4f31395d21c815d9fe92f91f20",
        "reviewAuthorityVersion": "retrieval-relevance-independent-review/1.0.0",
        "reviewReference": "issue-23",
        "reviewStatus": "independently-reviewed",
        "status": "accepted"
      },
      "reasonCodes": [
        "negative-control-comparison-alternative"
      ]
    },
    {
      "candidateId": "auth-casbin-node-casbin",
      "grade": 2,
      "provenance": {
        "reviewAuthorityDigest": "c64f49c7a7211b5e0304fd9e568dcd625e669d4f31395d21c815d9fe92f91f20",
        "reviewAuthorityVersion": "retrieval-relevance-independent-review/1.0.0",
        "reviewReference": "issue-23",
        "reviewStatus": "independently-reviewed",
        "status": "accepted"
      },
      "reasonCodes": [
        "negative-control-comparison-alternative"
      ]
    },
    {
      "candidateId": "auth-casdoor-casdoor",
      "grade": 1,
      "provenance": {
        "reviewAuthorityDigest": "c64f49c7a7211b5e0304fd9e568dcd625e669d4f31395d21c815d9fe92f91f20",
        "reviewAuthorityVersion": "retrieval-relevance-independent-review/1.0.0",
        "reviewReference": "issue-23",
        "reviewStatus": "independently-reviewed",
        "status": "accepted"
      },
      "reasonCodes": [
        "negative-control-comparison-alternative"
      ]
    },
    {
      "candidateId": "auth-cerbos-cerbos",
      "grade": 2,
      "provenance": {
        "reviewAuthorityDigest": "c64f49c7a7211b5e0304fd9e568dcd625e669d4f31395d21c815d9fe92f91f20",
        "reviewAuthorityVersion": "retrieval-relevance-independent-review/1.0.0",
        "reviewReference": "issue-23",
        "reviewStatus": "independently-reviewed",
        "status": "accepted"
      },
      "reasonCodes": [
        "negative-control-comparison-alternative"
      ]
    },
    {
      "candidateId": "auth-koa-roles",
      "grade": 2,
      "provenance": {
        "reviewAuthorityDigest": "c64f49c7a7211b5e0304fd9e568dcd625e669d4f31395d21c815d9fe92f91f20",
        "reviewAuthorityVersion": "retrieval-relevance-independent-review/1.0.0",
        "reviewReference": "issue-23",
        "reviewStatus": "independently-reviewed",
        "status": "accepted"
      },
      "reasonCodes": [
        "negative-control-comparison-alternative"
      ]
    },
    {
      "candidateId": "auth-open-policy-agent",
      "grade": 2,
      "provenance": {
        "reviewAuthorityDigest": "c64f49c7a7211b5e0304fd9e568dcd625e669d4f31395d21c815d9fe92f91f20",
        "reviewAuthorityVersion": "retrieval-relevance-independent-review/1.0.0",
        "reviewReference": "issue-23",
        "reviewStatus": "independently-reviewed",
        "status": "accepted"
      },
      "reasonCodes": [
        "negative-control-comparison-alternative"
      ]
    },
    {
      "candidateId": "auth-openfga",
      "grade": 2,
      "provenance": {
        "reviewAuthorityDigest": "c64f49c7a7211b5e0304fd9e568dcd625e669d4f31395d21c815d9fe92f91f20",
        "reviewAuthorityVersion": "retrieval-relevance-independent-review/1.0.0",
        "reviewReference": "issue-23",
        "reviewStatus": "independently-reviewed",
        "status": "accepted"
      },
      "reasonCodes": [
        "negative-control-comparison-alternative"
      ]
    },
    {
      "candidateId": "auth-ory-keto",
      "grade": 2,
      "provenance": {
        "reviewAuthorityDigest": "c64f49c7a7211b5e0304fd9e568dcd625e669d4f31395d21c815d9fe92f91f20",
        "reviewAuthorityVersion": "retrieval-relevance-independent-review/1.0.0",
        "reviewReference": "issue-23",
        "reviewStatus": "independently-reviewed",
        "status": "accepted"
      },
      "reasonCodes": [
        "negative-control-comparison-alternative"
      ]
    },
    {
      "candidateId": "auth-oso",
      "grade": 2,
      "provenance": {
        "reviewAuthorityDigest": "c64f49c7a7211b5e0304fd9e568dcd625e669d4f31395d21c815d9fe92f91f20",
        "reviewAuthorityVersion": "retrieval-relevance-independent-review/1.0.0",
        "reviewReference": "issue-23",
        "reviewStatus": "independently-reviewed",
        "status": "accepted"
      },
      "reasonCodes": [
        "negative-control-comparison-alternative"
      ]
    },
    {
      "candidateId": "auth-permify",
      "grade": 2,
      "provenance": {
        "reviewAuthorityDigest": "c64f49c7a7211b5e0304fd9e568dcd625e669d4f31395d21c815d9fe92f91f20",
        "reviewAuthorityVersion": "retrieval-relevance-independent-review/1.0.0",
        "reviewReference": "issue-23",
        "reviewStatus": "independently-reviewed",
        "status": "accepted"
      },
      "reasonCodes": [
        "negative-control-comparison-alternative"
      ]
    },
    {
      "candidateId": "auth-permit-js",
      "grade": 2,
      "provenance": {
        "reviewAuthorityDigest": "c64f49c7a7211b5e0304fd9e568dcd625e669d4f31395d21c815d9fe92f91f20",
        "reviewAuthorityVersion": "retrieval-relevance-independent-review/1.0.0",
        "reviewReference": "issue-23",
        "reviewStatus": "independently-reviewed",
        "status": "accepted"
      },
      "reasonCodes": [
        "negative-control-comparison-alternative"
      ]
    },
    {
      "candidateId": "auth-permit-opal",
      "grade": 1,
      "provenance": {
        "reviewAuthorityDigest": "c64f49c7a7211b5e0304fd9e568dcd625e669d4f31395d21c815d9fe92f91f20",
        "reviewAuthorityVersion": "retrieval-relevance-independent-review/1.0.0",
        "reviewReference": "issue-23",
        "reviewStatus": "independently-reviewed",
        "status": "accepted"
      },
      "reasonCodes": [
        "negative-control-comparison-alternative"
      ]
    },
    {
      "candidateId": "auth-stalniy-casl",
      "grade": 2,
      "provenance": {
        "reviewAuthorityDigest": "c64f49c7a7211b5e0304fd9e568dcd625e669d4f31395d21c815d9fe92f91f20",
        "reviewAuthorityVersion": "retrieval-relevance-independent-review/1.0.0",
        "reviewReference": "issue-23",
        "reviewStatus": "independently-reviewed",
        "status": "accepted"
      },
      "reasonCodes": [
        "negative-control-comparison-alternative"
      ]
    },
    {
      "candidateId": "auth-warrant",
      "grade": 2,
      "provenance": {
        "reviewAuthorityDigest": "c64f49c7a7211b5e0304fd9e568dcd625e669d4f31395d21c815d9fe92f91f20",
        "reviewAuthorityVersion": "retrieval-relevance-independent-review/1.0.0",
        "reviewReference": "issue-23",
        "reviewStatus": "independently-reviewed",
        "status": "accepted"
      },
      "reasonCodes": [
        "negative-control-comparison-alternative"
      ]
    }
  ],
  "provenance": {
    "reviewAuthorityDigest": "c64f49c7a7211b5e0304fd9e568dcd625e669d4f31395d21c815d9fe92f91f20",
    "reviewAuthorityVersion": "retrieval-relevance-independent-review/1.0.0",
    "reviewReference": "issue-23",
    "reviewStatus": "independently-reviewed",
    "status": "accepted"
  },
  "relevanceGoldVersion": "retrieval-relevance-gold/2.0.0"
}
