{
  "caseId": "ret-authorization-01",
  "judgments": [
    {
      "candidateId": "auth-aserto-topaz",
      "grade": 2,
      "provenance": {
        "reviewAuthorityDigest": "78f7cbfbf2f2ce0651ee03a9473961cf56f6370100f838fee8cf14ca9fae2892",
        "reviewAuthorityVersion": "retrieval-relevance-independent-review/1.0.0",
        "reviewReference": "issue-23",
        "reviewStatus": "independently-reviewed",
        "status": "accepted"
      },
      "reasonCodes": [
        "committed-curation-relevant-match"
      ]
    },
    {
      "candidateId": "auth-authzed-spicedb",
      "grade": 2,
      "provenance": {
        "reviewAuthorityDigest": "78f7cbfbf2f2ce0651ee03a9473961cf56f6370100f838fee8cf14ca9fae2892",
        "reviewAuthorityVersion": "retrieval-relevance-independent-review/1.0.0",
        "reviewReference": "issue-23",
        "reviewStatus": "independently-reviewed",
        "status": "accepted"
      },
      "reasonCodes": [
        "committed-curation-relevant-match"
      ]
    },
    {
      "candidateId": "auth-casbin-casbin",
      "grade": 2,
      "provenance": {
        "reviewAuthorityDigest": "78f7cbfbf2f2ce0651ee03a9473961cf56f6370100f838fee8cf14ca9fae2892",
        "reviewAuthorityVersion": "retrieval-relevance-independent-review/1.0.0",
        "reviewReference": "issue-23",
        "reviewStatus": "independently-reviewed",
        "status": "accepted"
      },
      "reasonCodes": [
        "committed-curation-relevant-match"
      ]
    },
    {
      "candidateId": "auth-casbin-casbin-js",
      "grade": 2,
      "provenance": {
        "reviewAuthorityDigest": "78f7cbfbf2f2ce0651ee03a9473961cf56f6370100f838fee8cf14ca9fae2892",
        "reviewAuthorityVersion": "retrieval-relevance-independent-review/1.0.0",
        "reviewReference": "issue-23",
        "reviewStatus": "independently-reviewed",
        "status": "accepted"
      },
      "reasonCodes": [
        "committed-curation-relevant-match"
      ]
    },
    {
      "candidateId": "auth-casbin-node-casbin",
      "grade": 2,
      "provenance": {
        "reviewAuthorityDigest": "78f7cbfbf2f2ce0651ee03a9473961cf56f6370100f838fee8cf14ca9fae2892",
        "reviewAuthorityVersion": "retrieval-relevance-independent-review/1.0.0",
        "reviewReference": "issue-23",
        "reviewStatus": "independently-reviewed",
        "status": "accepted"
      },
      "reasonCodes": [
        "committed-curation-relevant-match"
      ]
    },
    {
      "candidateId": "auth-casdoor-casdoor",
      "grade": 2,
      "provenance": {
        "reviewAuthorityDigest": "78f7cbfbf2f2ce0651ee03a9473961cf56f6370100f838fee8cf14ca9fae2892",
        "reviewAuthorityVersion": "retrieval-relevance-independent-review/1.0.0",
        "reviewReference": "issue-23",
        "reviewStatus": "independently-reviewed",
        "status": "accepted"
      },
      "reasonCodes": [
        "committed-curation-relevant-match"
      ]
    },
    {
      "candidateId": "auth-cerbos-cerbos",
      "grade": 2,
      "provenance": {
        "reviewAuthorityDigest": "78f7cbfbf2f2ce0651ee03a9473961cf56f6370100f838fee8cf14ca9fae2892",
        "reviewAuthorityVersion": "retrieval-relevance-independent-review/1.0.0",
        "reviewReference": "issue-23",
        "reviewStatus": "independently-reviewed",
        "status": "accepted"
      },
      "reasonCodes": [
        "committed-curation-relevant-match"
      ]
    },
    {
      "candidateId": "auth-koa-roles",
      "grade": 2,
      "provenance": {
        "reviewAuthorityDigest": "78f7cbfbf2f2ce0651ee03a9473961cf56f6370100f838fee8cf14ca9fae2892",
        "reviewAuthorityVersion": "retrieval-relevance-independent-review/1.0.0",
        "reviewReference": "issue-23",
        "reviewStatus": "independently-reviewed",
        "status": "accepted"
      },
      "reasonCodes": [
        "committed-curation-relevant-match"
      ]
    },
    {
      "candidateId": "auth-open-policy-agent",
      "grade": 3,
      "provenance": {
        "reviewAuthorityDigest": "78f7cbfbf2f2ce0651ee03a9473961cf56f6370100f838fee8cf14ca9fae2892",
        "reviewAuthorityVersion": "retrieval-relevance-independent-review/1.0.0",
        "reviewReference": "issue-23",
        "reviewStatus": "independently-reviewed",
        "status": "accepted"
      },
      "reasonCodes": [
        "committed-curation-direct-match"
      ]
    },
    {
      "candidateId": "auth-openfga",
      "grade": 3,
      "provenance": {
        "reviewAuthorityDigest": "78f7cbfbf2f2ce0651ee03a9473961cf56f6370100f838fee8cf14ca9fae2892",
        "reviewAuthorityVersion": "retrieval-relevance-independent-review/1.0.0",
        "reviewReference": "issue-23",
        "reviewStatus": "independently-reviewed",
        "status": "accepted"
      },
      "reasonCodes": [
        "committed-curation-direct-match"
      ]
    },
    {
      "candidateId": "auth-ory-keto",
      "grade": 2,
      "provenance": {
        "reviewAuthorityDigest": "78f7cbfbf2f2ce0651ee03a9473961cf56f6370100f838fee8cf14ca9fae2892",
        "reviewAuthorityVersion": "retrieval-relevance-independent-review/1.0.0",
        "reviewReference": "issue-23",
        "reviewStatus": "independently-reviewed",
        "status": "accepted"
      },
      "reasonCodes": [
        "committed-curation-relevant-match"
      ]
    },
    {
      "candidateId": "auth-oso",
      "grade": 2,
      "provenance": {
        "reviewAuthorityDigest": "78f7cbfbf2f2ce0651ee03a9473961cf56f6370100f838fee8cf14ca9fae2892",
        "reviewAuthorityVersion": "retrieval-relevance-independent-review/1.0.0",
        "reviewReference": "issue-23",
        "reviewStatus": "independently-reviewed",
        "status": "accepted"
      },
      "reasonCodes": [
        "committed-curation-relevant-match"
      ]
    },
    {
      "candidateId": "auth-permify",
      "grade": 2,
      "provenance": {
        "reviewAuthorityDigest": "78f7cbfbf2f2ce0651ee03a9473961cf56f6370100f838fee8cf14ca9fae2892",
        "reviewAuthorityVersion": "retrieval-relevance-independent-review/1.0.0",
        "reviewReference": "issue-23",
        "reviewStatus": "independently-reviewed",
        "status": "accepted"
      },
      "reasonCodes": [
        "committed-curation-relevant-match"
      ]
    },
    {
      "candidateId": "auth-permit-js",
      "grade": 2,
      "provenance": {
        "reviewAuthorityDigest": "78f7cbfbf2f2ce0651ee03a9473961cf56f6370100f838fee8cf14ca9fae2892",
        "reviewAuthorityVersion": "retrieval-relevance-independent-review/1.0.0",
        "reviewReference": "issue-23",
        "reviewStatus": "independently-reviewed",
        "status": "accepted"
      },
      "reasonCodes": [
        "committed-curation-relevant-match"
      ]
    },
    {
      "candidateId": "auth-permit-opal",
      "grade": 2,
      "provenance": {
        "reviewAuthorityDigest": "78f7cbfbf2f2ce0651ee03a9473961cf56f6370100f838fee8cf14ca9fae2892",
        "reviewAuthorityVersion": "retrieval-relevance-independent-review/1.0.0",
        "reviewReference": "issue-23",
        "reviewStatus": "independently-reviewed",
        "status": "accepted"
      },
      "reasonCodes": [
        "committed-curation-relevant-match"
      ]
    },
    {
      "candidateId": "auth-stalniy-casl",
      "grade": 2,
      "provenance": {
        "reviewAuthorityDigest": "78f7cbfbf2f2ce0651ee03a9473961cf56f6370100f838fee8cf14ca9fae2892",
        "reviewAuthorityVersion": "retrieval-relevance-independent-review/1.0.0",
        "reviewReference": "issue-23",
        "reviewStatus": "independently-reviewed",
        "status": "accepted"
      },
      "reasonCodes": [
        "committed-curation-relevant-match"
      ]
    },
    {
      "candidateId": "auth-warrant",
      "grade": 2,
      "provenance": {
        "reviewAuthorityDigest": "78f7cbfbf2f2ce0651ee03a9473961cf56f6370100f838fee8cf14ca9fae2892",
        "reviewAuthorityVersion": "retrieval-relevance-independent-review/1.0.0",
        "reviewReference": "issue-23",
        "reviewStatus": "independently-reviewed",
        "status": "accepted"
      },
      "reasonCodes": [
        "committed-curation-relevant-match"
      ]
    }
  ],
  "provenance": {
    "reviewAuthorityDigest": "78f7cbfbf2f2ce0651ee03a9473961cf56f6370100f838fee8cf14ca9fae2892",
    "reviewAuthorityVersion": "retrieval-relevance-independent-review/1.0.0",
    "reviewReference": "issue-23",
    "reviewStatus": "independently-reviewed",
    "status": "accepted"
  },
  "relevanceGoldVersion": "retrieval-relevance-gold/2.0.0"
}
