{
  "caseId": "ret-webhooks-06",
  "judgments": [
    {
      "candidateId": "webhook-adnanh",
      "grade": 1,
      "provenance": {
        "reviewAuthorityDigest": "78f7cbfbf2f2ce0651ee03a9473961cf56f6370100f838fee8cf14ca9fae2892",
        "reviewAuthorityVersion": "retrieval-relevance-independent-review/1.0.0",
        "reviewReference": "issue-23",
        "reviewStatus": "independently-reviewed",
        "status": "accepted"
      },
      "reasonCodes": [
        "negative-control-comparison-alternative"
      ]
    },
    {
      "candidateId": "webhook-convoy",
      "grade": 2,
      "provenance": {
        "reviewAuthorityDigest": "78f7cbfbf2f2ce0651ee03a9473961cf56f6370100f838fee8cf14ca9fae2892",
        "reviewAuthorityVersion": "retrieval-relevance-independent-review/1.0.0",
        "reviewReference": "issue-23",
        "reviewStatus": "independently-reviewed",
        "status": "accepted"
      },
      "reasonCodes": [
        "negative-control-comparison-alternative"
      ]
    },
    {
      "candidateId": "webhook-go-playground",
      "grade": 2,
      "provenance": {
        "reviewAuthorityDigest": "78f7cbfbf2f2ce0651ee03a9473961cf56f6370100f838fee8cf14ca9fae2892",
        "reviewAuthorityVersion": "retrieval-relevance-independent-review/1.0.0",
        "reviewReference": "issue-23",
        "reviewStatus": "independently-reviewed",
        "status": "accepted"
      },
      "reasonCodes": [
        "negative-control-comparison-alternative"
      ]
    },
    {
      "candidateId": "webhook-hook0",
      "grade": 2,
      "provenance": {
        "reviewAuthorityDigest": "78f7cbfbf2f2ce0651ee03a9473961cf56f6370100f838fee8cf14ca9fae2892",
        "reviewAuthorityVersion": "retrieval-relevance-independent-review/1.0.0",
        "reviewReference": "issue-23",
        "reviewStatus": "independently-reviewed",
        "status": "accepted"
      },
      "reasonCodes": [
        "negative-control-comparison-alternative"
      ]
    },
    {
      "candidateId": "webhook-hookdeck",
      "grade": 2,
      "provenance": {
        "reviewAuthorityDigest": "78f7cbfbf2f2ce0651ee03a9473961cf56f6370100f838fee8cf14ca9fae2892",
        "reviewAuthorityVersion": "retrieval-relevance-independent-review/1.0.0",
        "reviewReference": "issue-23",
        "reviewStatus": "independently-reviewed",
        "status": "accepted"
      },
      "reasonCodes": [
        "negative-control-comparison-alternative"
      ]
    },
    {
      "candidateId": "webhook-octokit-app",
      "grade": 2,
      "provenance": {
        "reviewAuthorityDigest": "78f7cbfbf2f2ce0651ee03a9473961cf56f6370100f838fee8cf14ca9fae2892",
        "reviewAuthorityVersion": "retrieval-relevance-independent-review/1.0.0",
        "reviewReference": "issue-23",
        "reviewStatus": "independently-reviewed",
        "status": "accepted"
      },
      "reasonCodes": [
        "negative-control-comparison-alternative"
      ]
    },
    {
      "candidateId": "webhook-octokit-methods",
      "grade": 2,
      "provenance": {
        "reviewAuthorityDigest": "78f7cbfbf2f2ce0651ee03a9473961cf56f6370100f838fee8cf14ca9fae2892",
        "reviewAuthorityVersion": "retrieval-relevance-independent-review/1.0.0",
        "reviewReference": "issue-23",
        "reviewStatus": "independently-reviewed",
        "status": "accepted"
      },
      "reasonCodes": [
        "negative-control-comparison-alternative"
      ]
    },
    {
      "candidateId": "webhook-octokit-webhooks",
      "grade": 2,
      "provenance": {
        "reviewAuthorityDigest": "78f7cbfbf2f2ce0651ee03a9473961cf56f6370100f838fee8cf14ca9fae2892",
        "reviewAuthorityVersion": "retrieval-relevance-independent-review/1.0.0",
        "reviewReference": "issue-23",
        "reviewStatus": "independently-reviewed",
        "status": "accepted"
      },
      "reasonCodes": [
        "negative-control-comparison-alternative"
      ]
    },
    {
      "candidateId": "webhook-standard-webhooks",
      "grade": 2,
      "provenance": {
        "reviewAuthorityDigest": "78f7cbfbf2f2ce0651ee03a9473961cf56f6370100f838fee8cf14ca9fae2892",
        "reviewAuthorityVersion": "retrieval-relevance-independent-review/1.0.0",
        "reviewReference": "issue-23",
        "reviewStatus": "independently-reviewed",
        "status": "accepted"
      },
      "reasonCodes": [
        "negative-control-comparison-alternative"
      ]
    },
    {
      "candidateId": "webhook-stripe-node",
      "grade": 2,
      "provenance": {
        "reviewAuthorityDigest": "78f7cbfbf2f2ce0651ee03a9473961cf56f6370100f838fee8cf14ca9fae2892",
        "reviewAuthorityVersion": "retrieval-relevance-independent-review/1.0.0",
        "reviewReference": "issue-23",
        "reviewStatus": "independently-reviewed",
        "status": "accepted"
      },
      "reasonCodes": [
        "negative-control-comparison-alternative"
      ]
    },
    {
      "candidateId": "webhook-svix",
      "grade": 2,
      "provenance": {
        "reviewAuthorityDigest": "78f7cbfbf2f2ce0651ee03a9473961cf56f6370100f838fee8cf14ca9fae2892",
        "reviewAuthorityVersion": "retrieval-relevance-independent-review/1.0.0",
        "reviewReference": "issue-23",
        "reviewStatus": "independently-reviewed",
        "status": "accepted"
      },
      "reasonCodes": [
        "negative-control-comparison-alternative"
      ]
    },
    {
      "candidateId": "webhook-webhook-site",
      "grade": 1,
      "provenance": {
        "reviewAuthorityDigest": "78f7cbfbf2f2ce0651ee03a9473961cf56f6370100f838fee8cf14ca9fae2892",
        "reviewAuthorityVersion": "retrieval-relevance-independent-review/1.0.0",
        "reviewReference": "issue-23",
        "reviewStatus": "independently-reviewed",
        "status": "accepted"
      },
      "reasonCodes": [
        "negative-control-comparison-alternative"
      ]
    },
    {
      "candidateId": "webhook-webhookx",
      "grade": 2,
      "provenance": {
        "reviewAuthorityDigest": "78f7cbfbf2f2ce0651ee03a9473961cf56f6370100f838fee8cf14ca9fae2892",
        "reviewAuthorityVersion": "retrieval-relevance-independent-review/1.0.0",
        "reviewReference": "issue-23",
        "reviewStatus": "independently-reviewed",
        "status": "accepted"
      },
      "reasonCodes": [
        "negative-control-comparison-alternative"
      ]
    }
  ],
  "provenance": {
    "reviewAuthorityDigest": "78f7cbfbf2f2ce0651ee03a9473961cf56f6370100f838fee8cf14ca9fae2892",
    "reviewAuthorityVersion": "retrieval-relevance-independent-review/1.0.0",
    "reviewReference": "issue-23",
    "reviewStatus": "independently-reviewed",
    "status": "accepted"
  },
  "relevanceGoldVersion": "retrieval-relevance-gold/2.0.0"
}
